URL||Product Name||Price||Store Name||Image URL||Rating||Description
https://www.tokopedia.com/sonic-phone101/iphone-xr-garansi-resmi-ibox-hitam-64-new-package?whid=0||Iphone XR Garansi Resmi Ibox||Rp7.379.000||Cv.Sentra inti pratama||https://images.tokopedia.net/img/cache/200-square/VqbcmM/2021/7/29/2be85b21-eeb4-4fa6-a7cd-6b82d28ada11.png.webp?ect=4g||5||Promo Price sesuai stok yang tersedia<br/>Unit baru dan terbatas<br/>Silahkan cekout jika stok masih ada<br/><br/><br/>Iphone XR - Garansi Resmi Apple<br/>Green Peel<br/>New Product<br/>Garansi Resmi Apple indonesia<br/><br/>Kode BARANG 64,128 Hitam ID/A<br/><br/>Product Air Pods pro Garansi Resmi<br/>mungkin anda menyukainya<br/>https://tokopedia.link/iDujiVpqWab<br/><br/>- Prodak Garansi 364 Hari<br/>( Tidak Sampai Setahun )<br/>Pada saat Aktifasi Connect Wifi<br/><br/>yang dipake dan diliat saat Claimb Garansi Adalah<br/>Tgl Estimasi Expired Atau Nota Pembelian<br/><br/>Mohon Melalukan Pengecekan pada saat pembelian - sebelum Aktifasi<br/><br/>Untuk Pengecekan Bisa untuk Link<br/>https://checkcoverage.apple.com<br/><br/>Perhatian !!<br/>Mohon teliti pada saat menerima produk ,<br/>Silahkan lalukan pengecekan status aktivasi terlebih dahulu , melalui link di bawah ini :<br/>https://checkcoverage.apple.com/<br/><br/>Garansi Resmi<br/>Tidak ada Garansi Toko<br/>Dengan Mengaktifkan Prodak , Pembeli Wajib Mengikuti Kebijakan<br/>Dan Garansi yg tertera<br/><br/>jam Operasional kami setiap harinya jam 11:30 - 18:30 Wib .<br/>untuk pengiriman Gosend/ Grab maksimal setiap harinya terakhir jam 15:45Wib<br/><br/>prodak harus di asuransikan dari pihak penjual dan penbeli.<br/>imei terdaftar di menki info.<br/><br/><br/>ulasan Toko:<br/>https://tokopedia.link/Zz937JAXEab<br/><br/>Prodak Prodak Lainnya:<br/>PowerBank Original<br/>https://tokopedia.link/lw8MhTlxCab<br/><br/>Tambahkan Apple Adapter:<br/>https://www.tokopedia.com/sonic-phone101/apple-power-adapter-20w-usb-c-original<br/><br/>Tambahkan Apple Earpods:<br/>https://www.tokopedia.com/sonic-phone101/apple-earpods-with-lightning-connector-original<br/><br/>Tambahkan Silikon:<br/>https://www.tokopedia.com/sonic-phone101/silicon-transparant-iphone-xr<br/><br/>Tambahkan Tempered Glass:<br/>https://www.tokopedia.com/sonic-phone101/tempered-glass-iphone-xr<br/><br/>Tambahkan Lamina Tempered Glass:<br/>https://www.tokopedia.com/sonic-phone101/lamina-tempered-glass-premium-iphone<br/><br/>Tambahkan Anti Gores Hydrogel:<br/>https://www.tokopedia.com/sonic-phone101/anti-gores-hydro-gel-rock-space-all-type
https://www.tokopedia.com/universestore/apple-iphone-xr-64-gb-garansi-resmi-apple-indonesia-ibox-tam-hitam?whid=0||Apple iPhone XR 64 GB - Garansi Resmi Apple indonesia ibox (TAM)||Rp7.449.000||Universe Store||https://images.tokopedia.net/img/cache/200-square/VqbcmM/2020/12/9/b2703941-bd06-4900-9d5a-c0be166332c3.jpg.webp?ect=4g||5||Garansi Resmi Apple indonesia iBox 1 Tahun<br/><br/>100% Original Baru dan Segel Asli Apple (Greenpeel)<br/><br/>INFO : iPhone XR Produksi terbaru sudah tidak mendapat Kepala Charger dan Headset ( isi Box : Kabel USB C to lightning dan iPhone)<br/><br/>Imei Terdaftar Resmi di Kemenperin<br/><br/>Fitur Produk :<br/><br/>OS : iOS 14<br/>Prosesor : Apple A12 Bionic<br/>Kamera : 12 MP dan 7 MP<br/>Layar : Liquid Retina HD display 6.1 Inch Touch display with IPS technology 1792 x 828-pixel resolution at 326 ppi<br/>Baterai : Non-removable Li-Ion battery<br/>Kapasitas : 64GB<br/><br/>Apple iPhone XR, hadir dengan Chipset Apple A12 Bionic yang di dukung iOS 12 serta Liquid Retina HD display 6.1 Inch Touch display with IPS technology 1792 x 828-pixel resolution at 326 ppi. Smartphone ini dilengkapi dengan fitur kamera utama berkapitas 12 MP dan kamera depan 7 MP, Sensor Face ID, Barometer, Three-axis gyro, Accelerometer, Proximity sensor, Ambient light sensor, dan SIM Card Dual SIM (nano-SIM and eSIM).
https://www.tokopedia.com/universestore/apple-iphone-12-128gb-garansi-resmi-ibox-apple-indonesia-biru?whid=0||Apple iPhone 12 128GB - Garansi Resmi iBox Apple Indonesia||Rp13.950.000||Universe Store||https://images.tokopedia.net/img/cache/200-square/VqbcmM/2020/12/18/ebc67dff-0fd4-4961-b1df-cccadd4e2b31.jpg.webp?ect=4g||5||Garansi Resmi Apple indonesia iBox 1 Tahun (TAM)<br/><br/>iPhone kami Garansi iBox Model Number di akhiri PA/A dan ada tulisan importir Erajaya Swasembada<br/><br/>100% Original Baru dan Segel Asli Apple (Greenpeel)<br/><br/>Imei Terdaftar Resmi di Kemenperin<br/><br/>Isi Kotak :<br/>• iPhone dengan iOS 14.<br/>• Kabel USB-C ke Lightning.<br/>• Buku Manual dan Dokumentasi lain.<br/><br/>Poin-poin fitur<br/>• Layar Super Retina XDR 6,1 inci (1)<br/>• Ceramic Shield, lebih tangguh dari kaca ponsel pintar mana pun<br/>• Chip A14 Bionic, chip paling cepat yang pernah ada di ponsel pintar<br/>• Sistem kamera ganda canggih dengan kamera Ultra Wide dan Wide 12 MP;  mode Malam, Deep Fusion,<br/>Smart HDR 3, perekaman HDR 4K Dolby Vision<br/>• Kamera depan TrueDepth 12 MP dengan mode Malam, perekaman HDR 4K Dolby Vision<br/>• Level ketahanan air IP68 terdepan di industri(4)<br/>• Mendukung aksesori MagSafe untuk kemudahan pemasangan dan pengisian daya nirkabel yang lebih cepat(3)<br/>• iOS 14 dengan widget yang didesain ulang di Layar Home, Perpustakaan App yang sepenuhnya baru, Cuplikan App, dan banyak lagi
https://www.tokopedia.com/distriponsel/xiaomi-poco-x3-pro-8-256gb-6-128gb-garansi-resmi-8-gb-256-gb-6-gb-128-6gb-128gb-non-bundle?whid=0||Xiaomi Poco X3 Pro 8/256GB 6/128GB Garansi resmi 8 GB 256 GB 6 GB 128||Rp3.425.000||Distributor Ponsel||https://images.tokopedia.net/img/cache/200-square/VqbcmM/2021/5/11/8bf5edea-7423-475b-8edc-4d0ad56ac0d0.jpg.webp?ect=4g||5||Tersedia juga aksesoris kompatible dengan produk ini:<br/>Anti Gores: https://www.tokopedia.com/distriponsel/anti-gores-jelly-tempered-glass-hydrogel-xiaomi-samsung-vivo-oppo-real<br/>TWS: https://www.tokopedia.com/distriponsel/realme-buds-air-pro-garansi-resmi-realme-original-realme-tws<br/>Powerbank: https://www.tokopedia.com/distriponsel/realme-powerbank-power-bank-2i-10000mah-quick-charge-dual-output<br/><br/>Packing yang lebih aman (Opsional, untuk standar packing kami sudah memakai bubble wrap) :<br/>Ekstra Bubble: https://www.tokopedia.com/distriponsel/ekstra-bubble-wrap-untuk-packing<br/>Packing Kayu: https://www.tokopedia.com/distriponsel/packing-kayu-untuk-handphone<br/><br/><br/>Mengenai varian:<br/>Non Bundle = Tidak dapat bonus yang seperti digambar<br/>Bundle Headset = Dapat bonus Realme Buds Classic<br/>Bundle Powerbank = Dapat bonus Realme Powerbank 2i<br/>Bundle Hydrogel = Dapat bonus Anti Gores Hydrogel<br/>Bundle Lengkap = Dapat semua bonus yang disebutkan diatas<br/><br/>Melayani COD dengan harga lebih murah dari toko kami di Tokopedia, silahkan chat Whatsapp ke 0878-8831-6441<br/><br/>HARAP DIBACA SEBELUM MEMBELI<br/>WARNA READY: Hitam, Biru, Bronze<br/>CANTUMKAN PILIHAN WARNA PADA CATATAN UNTUK PENJUAL<br/>BONUS AKAN DIKIRIMKAN SELAMA STOCK TERSEDIA<br/><br/>Belanja lebih hemat pakai voucher, cek disini:<br/>https://www.tokopedia.com/promo/<br/><br/>NOTE SEBELUM MEMBELI:<br/>- Barang yang dijual adalah BNIB ( Brand New In Box ) kita tidak jual barang bekas ataupun refurbish<br/>- Untuk product Oppo, Vivo dan Realme segel terlebih dahulu kita buka sebelum di kirim, untuk di ambil & di registrasi kartu garansi.<br/>- Spesifikasi lengkap dapat dicek melalui website resmi masing- masing produk.<br/>- Kerusakan dan kehilangan saat pengiriman diluar tanggung jawab kami.<br/>- Sangat disarankan memakai Asuransi pengiriman untuk menghindari resiko pengiriman.<br/>- Barang yang sudah dibeli tidak dapat ditukar atau di kembalikan, kecuali ada cacat barang saat baru dibuka.
https://www.tokopedia.com/shopyzid/samsung-galaxy-m32-nfc-5000mah-8gb-128gb-8-128-garansi-resmi-hitam?whid=0||SAMSUNG GALAXY M32 - NFC - 5000mAh - 8GB 128GB 8/128 - Garansi Resmi||Rp3.149.900||Shopyz ID||https://images.tokopedia.net/img/cache/200-square/VqbcmM/2021/7/29/96748ddc-68de-423e-b34b-78818ea0b715.jpg.webp?ect=4g||5||SAMSUNG GALAXY M32 8/128GB<br/><br/>GARANSI RESMI SEIN SAMSUNG INDONESIA<br/>IMEI TERDAFTAR DI WEBSITE KEMENPERIN<br/><br/>WARNA TERSEDIA SESUAI VARIAN<br/>- HITAM<br/>- BIRU<br/>- PUTIH<br/><br/>Spesifikasi :<br/><br/>NETWORK Technology<br/>GSM / HSPA / LTE<br/>LAUNCH Announced 2021, June 21<br/>Status Available. Released 2021, June 28<br/>BODY Dimensions 159.3 x 74 x 8.4 mm<br/>Weight 180 g<br/>Build Glass front, plastic frame, plastic back<br/>SIM Dual SIM (Nano-SIM, dual stand-by)<br/>DISPLAY Type Super AMOLED, 90Hz, 800 nits (HBM)<br/>Size 6.4 inches, 98.9 cm2 (~83.9% screen-to-body ratio)<br/>Resolution 1080 x 2400 pixels, 20:9 ratio (~411 ppi density)<br/>PLATFORM OS Android 11, One UI 3.1<br/>Chipset Mediatek Helio G80 (12 nm)<br/>CPU Octa-core (2x2.0 GHz Cortex-A75 & 6x1.8 GHz Cortex-A55)<br/>GPU Mali-G52 MC2<br/>MEMORY Card slot microSDXC (dedicated slot)<br/>Internal 128GB, 8GB RAM<br/>eMMC 5.1<br/>MAIN CAMERA Quad 64 MP, f/1.8, 26mm (wide), 1/1.97", 0.7µm, PDAF<br/>8 MP, f/2.2, 123˚, (ultrawide), 1/4.0", 1.12µm<br/>2 MP, f/2.4, (macro)<br/>2 MP, f/2.4, (depth)<br/>Features LED flash, panorama, HDR<br/>Video 1080p@30fps<br/>SELFIE CAMERA Single 20 MP, f/2.2, (wide)<br/>Video 1080p@30fps<br/>SOUND Loudspeaker Yes<br/>3.5mm jack Yes<br/>COMMS WLAN Wi-Fi 802.11 a/b/g/n/ac, dual-band, Wi-Fi Direct, hotspot<br/>Bluetooth 5.0, A2DP, LE<br/>GPS Yes, with A-GPS, GLONASS, BDS, GALILEO<br/>NFC Yes<br/>Radio Unspecified<br/>USB USB Type-C 2.0, USB On-The-Go<br/>FEATURES Sensors Fingerprint (side-mounted), accelerometer, gyro, compass<br/>Virtual proximity sensing<br/>BATTERY Type Li-Ion 5000 mAh, non-removable<br/>Charging Fast charging 25W
https://www.tokopedia.com/universestore/xiaomi-redmi-9c-4-64-gb-garansi-resmi-xiaomi-indonesia-abu-abu?whid=0||Xiaomi Redmi 9C 4/64 GB - Garansi Resmi Xiaomi Indonesia||Rp1.720.000||Universe Store||https://images.tokopedia.net/img/cache/200-square/VqbcmM/2020/9/23/49d968e6-b5e1-42a0-bbf6-bcc38b6848ad.jpg.webp?ect=4g||5||Garansi Resmi Xiaomi Indonesia 1 Tahun<br/><br/>100% Original Baru dan Segel<br/><br/>Imei Terdaftar Resmi di Kemenperin<br/><br/>Spesifikasi :<br/><br/>Jaringan GSM / HSPA / LTE<br/>Sistem Operasi Android 10<br/>Prosesor MediaTek Helio G35 (12 nm) Octa-core (4x2.3 GHz Cortex-A53 & 4x1.8 GHz Cortex-A53)<br/>GPU PowerVR GE8320<br/>RAM 4 GB<br/>ROM 64 GB<br/>Ukuran Layar 6.53 inch<br/>Tipe Layar IPS LCD capacitive touchscreen, 16M colors<br/>Resolusi Layar 720 x 1600 pixels, 20:9 ratio (~269 ppi density)<br/>Kamera Belakang<br/><br/>Triple<br/>13 MP, f/2.2, 28mm (wide), PDAF<br/>2 MP, f/2.4, (macro)<br/>2 MP, f/2.4, (depth)<br/>Kamera Depan 5 MP, f/2.2, (wide), 1.12µm<br/>Fitur Kamera HDR, AI portrait mode, Face recognition, AI Beautify 5.0, AI scene detection, Single tone flash, Kaleidoscope effects<br/>Audio 3.5mm jack, Audio output by 1712 speaker with big box<br/>WLAN Wi-Fi 802.11 b/g/n, Wi-Fi Direct, hotspot<br/>Bluetooth 5.0, A2DP, LE<br/>GPS A-GPS, GLONASS, BDS<br/>Sensor Fingerprint (rear-mounted), Vibration Motor, Distance Sensor, Ambient Light Sensor, Accelerometer<br/>Baterai 5000 mAh<br/>Pengisian Daya microUSB 2.0, Charging 10W<br/>Slot Memori Eksternal MicroSD Slot<br/>SIM Dual Nano SIM<br/>Berat 196 g<br/>Dimensi 164.9 x 77 x 9 mm
https://www.tokopedia.com/gudang-hp/infinix-note-10-pro-6-64-gb-garansi-resmi-nordic-secret?whid=0||Infinix Note 10 Pro 6/64 GB Garansi Resmi||Rp2.550.000||Gudang-HP||https://images.tokopedia.net/img/cache/200-square/VqbcmM/2021/6/21/970616ae-c2c6-426e-b627-9cf7c72129b7.jpg.webp?ect=4g||5||Ready Stok *30 September 2021<br/><br/>SIM Dual SIM (Nano-SIM, dual stand-by)<br/>Size 6.95 inches<br/>PLATFORM OS Android 11, XOS 7.6<br/>Chipset Mediatek Helio G95 (12 nm)<br/>CPU Octa-core (2x2.05 GHz Cortex-A76 & 6x2.0 GHz Cortex-A55)<br/>GPU Mali-G76 MC4<br/>MEMORY Internal 64GB 6GB RAM<br/>MAIN CAMERA Quad 64 MP,8 MP,2 MP,2 MP<br/>SELFIE CAMERA Single 16 MP<br/>BATTERY Type Li-Po 5000 mAh, non-removable
https://www.tokopedia.com/smilemobile/xiaomi-poco-m3-4-64gb-garansi-resmi-pt-xiaomi-indonesia-cool-blue?whid=0||Xiaomi POCO M3 - 4/64GB - GARANSI RESMI PT. XIAOMI INDONESIA||Rp1.899.000||Smile Mobile Phone Shop||https://images.tokopedia.net/img/cache/200-square/VqbcmM/2021/2/10/a008c9e3-9e49-4702-87c9-40aaa25caea9.jpg.webp?ect=4g||5||SIM Dual SIM (Nano-SIM, dual stand-by)<br/>Size 6.53 inches, 104.7 cm2 (~83.4% screen-to-body ratio)<br/>PLATFORM OS Android 10, MIUI 12<br/>Chipset Qualcomm SM6115 Snapdragon 662 (11 nm)<br/>CPU Octa-core (4x2.0 GHz Kryo 260 Gold & 4x1.8 GHz Kryo 260 Silver)<br/>GPU Adreno 610<br/>Internal 128GB 6GB RAM<br/>MAIN CAMERA Triple 48 MP, 2 MP, 2 MP,<br/>SELFIE CAMERA Single 8 MP,<br/>BATTERY Type Li-Po 6000 mAh, non-removable
https://www.tokopedia.com/36shop/realme-8-8gb-128gb-garansi-resmi-realme-indonesia-black-4g?whid=0||Realme 8 8GB+128GB Garansi Resmi Realme Indonesia||Rp3.289.000||36shop||https://images.tokopedia.net/img/cache/200-square/VqbcmM/2021/7/26/a7a07a72-2fdc-45cd-b7ac-63b2cd1527bc.jpg.webp?ect=4g||5||Realme 8 8GB+128GB Garansi Resmi Realme Indonesia<br/><br/>Penting<br/>- Garansi Resmi Realme<br/>- Imei Terdaftar di Kemenprin<br/><br/>Kelengkapan<br/>- 1 Buah Handphone<br/>- Charger<br/>- Kabel Usb<br/>- Softcase<br/><br/>Body<br/>Dimensions 160.6 x 73.9 x 8 mm (6.32 x 2.91 x 0.31 in)<br/>Weight 177 g (6.24 oz)<br/>Build Glass front, plastic frame, plastic back<br/>SIM<br/>Dual SIM (Nano-SIM, dual stand-by)<br/>Display<br/>Type Super AMOLED, 1000 nits (peak)<br/>Size 6.4 inches, 98.9 cm2 (~83.3% screen-to-body ratio)<br/>Resolution 1080 x 2400 pixels, 20:9 ratio (~411 ppi density)<br/>Always-on display<br/>Platform<br/>OS Android 11, Realme UI 2.0<br/>Chipset<br/>Mediatek Helio G95 (12 nm)<br/>CPU Octa-core (2x2.05 GHz Cortex-A76 & 6x2.0 GHz Cortex-A55)<br/>GPU Mali-G76 MC4<br/>Memory<br/>Card slot microSDXC (dedicated slot)<br/>Internal 128GB 4GB RAM, 128GB 6GB RAM, 128GB 8GB RAM<br/>UFS 2.1<br/>Main Camera<br/>Quad 64 MP, f/1.8, 26mm (wide), 1/1.73", 0.8µm, PDAF<br/>8 MP, f/2.3, 119˚, 16mm (ultrawide), 1/4.0", 1.12µm<br/>2 MP, f/2.4, (macro)<br/>2 MP, f/2.4, (depth)<br/>Features<br/>LED flash, HDR, panorama<br/>Video 4K@30fps, 1080p@30/60/120fps, gyro-EIS<br/>Selfie camera<br/>Single 16 MP, f/2.5, (wide), 1/3.0", 1.0µm<br/>Features<br/>HDR, panorama<br/>Video 1080p@30/120fps, gyro-EIS<br/>Sound<br/>Loudspeaker Yes<br/>3.5mm jack Yes<br/>24-bit/192kHz audio<br/>Comms<br/>WLAN Wi-Fi 802.11 a/b/g/n/ac, dual-band, Wi-Fi Direct, hotspot<br/>Bluetooth 5.1, A2DP, LE<br/>GPS Yes, with A-GPS, GLONASS, BDS<br/>NFC Yes<br/>Radio FM radio<br/>USB<br/>USB Type-C 2.0, USB On-The-Go<br/>Features<br/>Sensors Fingerprint (under display, optical), accelerometer, gyro, proximity, compass<br/>Battery<br/>Type Li-Po 5000 mAh, non-removable
https://www.tokopedia.com/gudang-hp/infinix-hot-10-play-4-64-gb-garansi-resmi-hijau?whid=0||Infinix Hot 10 Play 4/64 GB Garansi Resmi||Rp1.539.000||Gudang-HP||https://images.tokopedia.net/img/cache/200-square/VqbcmM/2021/5/5/354e01e8-7ff6-4d3f-bddd-9a643673bdc4.jpg.webp?ect=4g||5||Ready Stock *16 September 2021<br/><br/>SIM Dual SIM (Nano-SIM, dual stand-by)<br/>Size 6.82 inches,<br/>PLATFORM OS Android 10 (Go edition), XOS 7<br/>Chipset MediaTek Helio G35 (12 nm)<br/>CPU Octa-core (2x2.0 GHz Cortex-A75 & 6x1.8 GHz Cortex-A55)<br/>GPU Mali-G52 MC2<br/>Internal 64GB 4GB RAM,<br/>MAIN CAMERA Dual 13 MP,<br/>SELFIE CAMERA Single 8 MP,<br/>BATTERY Type Li-Po 6000 mAh, non-removable
https://www.tokopedia.com/hapemallid/xiaomi-poco-m3-6-128gb-garansi-resmi-xiaomi-termurah-se-indonesia-hitam?whid=0||XIAOMI POCO M3 6/128GB GARANSI RESMI XIAOMI TERMURAH SE INDONESIA||Rp2.288.400||Hapemall.id||https://images.tokopedia.net/img/cache/200-square/VqbcmM/2021/2/1/d4c85d63-6edf-43ab-a988-850056eb0e96.jpg.webp?ect=4g||5||Operating System: MIUI 12 untuk POCO, berbasis Android 10<br/>Simcard Slot: Dual sim<br/>Battery Capacity: 6000mAh<br/>Kamera Belakang: 48MP AI Triple Kamera<br/>48 MP Kamera utama<br/>Kamera Depan: 8 MP Kamera Depan<br/>Screen Size: 6.53" FHD+ Layar Dot Drop<br/>Sertifikasi TÜV Rheinland® Low Blue Light<br/>Resolusi: 2340x1080 FHD+
https://www.tokopedia.com/prismaroxy/xiaomi-redmi-9a-3-32-garansi-resmi-tam-biru?whid=0||Xiaomi Redmi 9A 3/32 Garansi Resmi TAM||Rp1.415.000||PRISMA ROXY||https://images.tokopedia.net/img/cache/200-square/VqbcmM/2021/2/20/5674053d-b012-45a9-ab96-51358d254c81.jpg.webp?ect=4g||5||SEMUA XIAOMI PRISMA ROXY = NO REPACK, ORIGINAL FRESH BNIB !!!<br/><br/>XIAOMI REDMI 9A 3/32 GARANSI RESMI TAM<br/><br/>SIM Dual SIM (Nano-SIM, dual stand-by)<br/>Size 6.53 inches, 102.9 cm2 (~81.1% screen-to-body ratio)<br/>PLATFORM OS Android 10, MIUI 12<br/>Chipset MediaTek Helio G25 (12 nm)<br/>CPU Octa-core 2.0 GHz Cortex-A53<br/>GPU PowerVR GE8320<br/>Internal 32GB 3GB RAM<br/>MAIN CAMERA Single 13 MP, f/2.2, 28mm (wide), PDAF<br/>SELFIE CAMERA Single 5 MP, f/2.2, (wide), 1.12µm<br/>BATTERY Li-Po 5000 mAh, non-removable
https://www.tokopedia.com/gudang-hp/realme-8-8-128-gb-garansi-resmi-silver?whid=0||Realme 8 8/128 GB Garansi Resmi||Rp3.304.000||Gudang-HP||https://images.tokopedia.net/img/cache/200-square/VqbcmM/2021/6/22/3ef0cad9-ce64-4709-aa10-647d48130da5.jpg.webp?ect=4g||5||Ready Stok Black dan Blue*30 Juni 2021<br/><br/>SIM Dual SIM (Nano-SIM, dual stand-by)<br/>Size 6.4 inches<br/>PLATFORM OS Android 11, Realme UI 2.0<br/>Chipset Mediatek Helio G95 (12 nm)<br/>CPU Octa-core (2x2.05 GHz Cortex-A76 & 6x2.0 GHz Cortex-A55)<br/>GPU Mali-G76 MC4<br/>MEMORY Internal 128GB 8GB RAM<br/>MAIN CAMERA Quad 64 MP,8 MP,2 MP,2 MP,<br/>SELFIE CAMERA Single 16 MP,<br/>BATTERY Type Li-Po 5000 mAh, non-removable
https://www.tokopedia.com/gardencell/infinix-hot-10-play-4-64gb-garansi-resmi-hijau?whid=0||INFINIX HOT 10 PLAY 4/64GB GARANSI RESMI||Rp1.535.000||Garden Cell Official||https://images.tokopedia.net/img/cache/200-square/VqbcmM/2021/5/18/46818de4-4aee-446b-a9b8-107ac49df31f.jpg.webp?ect=4g||5||Network Technology GSM / HSPA / LTE<br/>Launch Announced 2021, January 21<br/>Status Available. Released 2021, January 21<br/>Body Dimensions 171.8 x 78 x 8.9 mm (6.76 x 3.07 x 0.35 in)Weight 207 g (7.30 oz)<br/>Build Glass front, plastic back, plastic frame<br/>SIM Dual SIM (Nano-SIM, dual stand-by)<br/>Display Type IPS LCD, 440 nits (typ)<br/>Size 6.82 inches, 110.5 cm2 (~82.4% screen-to-body ratio)<br/>Resolution 720 x 1640 pixels (~263 ppi density)Platform OS Android 10 (Go edition), XOS 7<br/>Chipset MediaTek Helio G25 (12 nm)<br/>CPU Octa-core (4x2.0 GHz Cortex-A53 & 4x1.5 GHz Cortex-A53)<br/>GPU PowerVR GE8320<br/>Memory Card slot microSDXC (dedicated slot)<br/>Internal 32GB 2GB RAM, 64GB 4GB RAM eMMC 5.1<br/>Main Camera Dual 13 MP, f/1.8, (wide), 1/3.1", 1.12µm, AF<br/>Secondary unspecified camera<br/>Features Quad-LED flash, panorama, HDR<br/>Video 1080p@30fps<br/>Selfie camera Single 8 MP, f/2.0, (wide)<br/>Features LED flash<br/>Video 1080p@30fps<br/>Sound Loudspeaker Yes 3.5mm jack Yes<br/>Comms WLAN Wi-Fi 802.11 a/b/g/n/ac, dual-band, Wi-Fi Direct, hotspot<br/>Bluetooth 5.0, A2DP, LE<br/>GPS Yes, with A-GPS<br/>NFC No<br/>Radio FM radio<br/>USB microUSB 2.0, USB On-The-Go<br/>Features Sensors Fingerprint (rear-mounted), accelerometer, proximity, compass<br/>Battery Type Li-Po 6000 mAh, non-removable<br/>Charging Charging 10W
https://www.tokopedia.com/best-phone-cell/realme-8-8-128gb-nfc-garansi-resmi-silver?whid=0||Realme 8 8/128GB NFC Garansi Resmi||Rp3.313.000||Best Phone Cell||https://images.tokopedia.net/img/cache/200-square/VqbcmM/2021/4/13/e647a8a3-b49a-4384-9374-8c8ec9ddcad1.png.webp?ect=4g||5||SPESIFIKASI :<br/><br/>6.43” Super AMOLED Full Screen<br/>RAM 8GB + ROM 128GB<br/>Helio G95 Gaming Processor<br/>30W+ Benchmark (AnTutu)<br/>2.0GHz<br/>Octa-core<br/>Process: 12nm<br/>CPU: Cortex-A76 2.0GHz *2 + Cortex-A55 2.0GHz *6<br/>GPU: ARM G76<br/><br/>64MP AI Quad Camera<br/>64MP Primary Camera<br/>8MP Wide-angle Camera<br/>2MP Macro Camera<br/>2MP Mono Camera<br/><br/>Infinite Bold Design<br/>Future Digital Design<br/>Split Design & Splicing Process<br/>Super Slim & Light<br/><br/>30W Dart Charge<br/>3 mins Dart Charge<br/>Standby 67 hrs<br/>Spotify 7-hour (with earphone)<br/>Call 3-hour<br/>whatsapp 95mins<br/><br/>5000mAh Massive Battery<br/>Super Power Saving<br/>Other Power Saving Functiom<br/>Reverse charge<br/><br/>16MP In-display Selfie<br/><br/>realme UI 2.0<br/>Latest Andriod 11<br/><br/>Ultra-fast In-display Fingerprint<br/><br/>Hi-Res Audio Certification
https://www.tokopedia.com/evogad/realme-8-helio-g95-gaming-processor-64mp-ai-quad-camera-black?whid=0||Realme 8 Helio G95 Gaming Processor, 64MP AI Quad Camera||Rp3.436.000||Evogad Official||https://images.tokopedia.net/img/cache/200-square/VqbcmM/2021/8/9/ad001480-0030-4773-b897-4ac6d33f33b6.jpg.webp?ect=4g||5||Varian :<br/>- Black (Hanya Handphone Saja)<br/>- Blue (Hanya Handphone Saja)<br/>- VIP Black (Paket Lengkap+ Headset Oase)<br/>- VIP Silver (Paket Lengkap + Headset Oase)<br/><br/>Pilih Paket VIP Dapat :<br/><br/>1. Headset oase (Top Quality)<br/>2. Softcase (Top Quality in box)<br/>3. Anti gores (Top Quality in box)<br/>4. Perdana Smartfren<br/>5. Cable Protector<br/>6. IRING<br/>7. Penjepit Cable<br/><br/>Garansi Resmi Realme Indonesia 1 tahun.<br/>Garansi tukar unit 3x24 jam<br/>Garansi kerusakan dan ganti unit baru 7x24 jam sejak barang diterima<br/>IMEI terdaftar di KOMINFO, bisa di cek melalui website :<br/>https://imei.kemenperin.go.id/<br/><br/>Gratis Ongkos Kirim (kode Voucher EVOGONGKIR)<br/>Gratis Biaya Admin 2% dengan metode pembayaran kartu kredit<br/>Gratis Cicilan 0%<br/><br/>Ayo pake bubble tambahan agar paket semakin aman saat pengiriman.<br/>https://www.tokopedia.com/evogad/tambahan-bubble-wrap?m_id=18262567<br/><br/>Powerbank Realme lagi diskon nih gais<br/>https://www.tokopedia.com/evogad/realme-powerbank-2i-10000mah-quick-charge-dual-output-original<br/><br/>Spesifikasi :<br/>Ukuran layar: 6.4 inci, 1080 x 2400 pixels, Super AMOLED<br/>Memori: RAM 8 GB, ROM 128 GB, MicroSD slot<br/>Sistem operasi: Android 11, Realme UI 2.0<br/>CPU: Mediatek Helio G95 (12 nm) Octa-core up to 2.05 GHz<br/>GPU: Mali-G76 MC4<br/>Kamera: Quad 64 MP, f/1.79, 26mm (wide); 8 MP, f/2.25, 119˚, 16mm (ultrawide); 2 MP, f/2.4, (macro); 2 MP, f/2.4, (depth), depan 16 MP, f/2.45, (wide)<br/>SIM: Dual SIM (Nano-SIM)<br/>Baterai: Li-Po 5000 mAh, non-removable<br/>Berat: 177 gram<br/>NFC
https://www.tokopedia.com/ceriaponselos/realme-c20-5000-mah-6-5-large-display-helio-g35-gaming-processor-abu-abu?whid=0||Realme C20 [5000 mAh, 6.5" Large Display, Helio G35 Gaming Processor]||Rp1.335.000||Ceria Ponsel Official||https://images.tokopedia.net/img/cache/200-square/VqbcmM/2021/8/18/81af7118-53f8-4156-84ca-2583b92bc579.jpg.webp?ect=4g||5||Varian :<br/>- Abu-Abu (Tanpa Gift)<br/>- Biru (Tanpa Gift)<br/>- Ceria Grey (Paket Lengkap+ Headset Oase)<br/>- Ceria Blue (Paket Lengkap + Headset Oase)<br/><br/>Pilih Varian Ceria Dapat Paket Lengkap :<br/><br/>1. Headset oase (Top Quality)<br/>2. Perdana Smartfren<br/>3. Cable Protector<br/>4. Iring<br/>5. Penjepit Kabel<br/><br/>Garansi Resmi 1 tahun<br/>Garansi Tukar Unit baru jika rusak dalam 1 minggu sejak barang diterima<br/>Bisa tukar warna Maks 3 hari setelah barang diterima.<br/>Bisa titip Service<br/><br/>IMEI terdaftar di KOMINFO, bisa di cek melalui website :<br/>https://imei.kemenperin.go.id/<br/><br/>Spesifikasi :<br/>Ukuran layar: 6.5 inches, 720 x 1600 pixels (~270 ppi density) IPS LCD<br/>Memori: RAM 2GB, ROM 32GB, microSDXC Slot<br/>Sistem operasi: Android 11; Realme UI<br/>CPU: MediaTek Helio G35 (12 nm), Octa-core (4x2.3 GHz Cortex-A53 & 4x1.8 GHz Cortex-A53)<br/>GPU: PowerVR GE8320<br/>Kamera Belakang: 8 MP f/2.0 AF (wide)<br/>Kamera Depan: 5 MP f/2.2 (wide)<br/>SIM: Dual SIM (Nano-SIM, dual stand-by)<br/>Baterai: Li-Po 5000 mAh, non-removable<br/>Berat: 190 gr<br/>Garansi Resmi
https://www.tokopedia.com/ptbje/infinix-hot-10s-ram-6-128?whid=0||INFINIX HOT 10S||Rp1.990.000||PURICELL STORE||https://images.tokopedia.net/img/cache/200-square/VqbcmM/2021/8/6/91df0d6a-75d5-4a72-86c8-aaa5f84ea4f0.jpg.webp?ect=4g||5||NETWORK Technology<br/>GSM / HSPA / LTE<br/>LAUNCH Announced 2021, April 21<br/>Status Available. Released 2021, May 12<br/>BODY Dimensions 171.5 x 77.5 x 9.2 mm (6.75 x 3.05 x 0.36 in)<br/>Weight -<br/>Build Glass front, plastic back, plastic frame<br/>SIM Dual SIM (Nano-SIM, dual stand-by)<br/>DISPLAY Type IPS LCD, 90Hz<br/>Size 6.82 inches, 110.5 cm2 (~83.1% screen-to-body ratio)<br/>Resolution 720 x 1640 pixels (~263 ppi density)<br/>PLATFORM OS Android 11, XOS 7.6<br/>Chipset MediaTek Helio G85 (12nm)<br/>CPU Octa-core (2x2.0 GHz Cortex-A75 & 6x1.8 GHz Cortex-A55)<br/>GPU Mali-G52 MC2<br/>MEMORY Card slot microSDXC (dedicated slot)<br/>Internal 64GB 4GB RAM, 64GB 6GB RAM, 128GB 4GB RAM, 128GB 6GB RAM<br/>eMMC 5.1<br/>MAIN CAMERA Triple 48 MP, f/1.8, (wide), 1/2.0, 0.8µm, PDAF<br/>2 MP, f/2.4, (depth)<br/>Third, unknown camera<br/>Features Quad-LED flash, HDR, panorama<br/>Video 1080p@30fps<br/>SELFIE CAMERA Single 8 MP, (wide)<br/>Features Dual-LED flash<br/>Video 1080p@30fps<br/>SOUND Loudspeaker Yes<br/>3.5mm jack Yes<br/>COMMS WLAN Wi-Fi 802.11 a/b/g/n/ac, dual-band, Wi-Fi Direct, hotspot<br/>Bluetooth 5.0, A2DP, LE<br/>GPS Yes, with A-GPS<br/>NFC No<br/>Radio FM radio<br/>USB microUSB 2.0, USB On-The-Go<br/>FEATURES Sensors Fingerprint (rear-mounted), accelerometer, proximity<br/>BATTERY Type Li-Po 6000 mAh, non-removable
